mean pos,mean neg,Tweet
1,1,devoncarrots the primary interest of the members is figure skating but anything related to a sport w blades attached to boots is welcome
3,1,Dr Lauras advice today is for women to stop picking birds with broken wings and instead choose the highsoaring eagles Come on ladies
3,2,pieper I have no clue but thats good advice LOL
1,2,nugzy i used to read come as you are all the time i was a nirvana tragic much long after kurt died around 9596 
3,1,i feel no shame im proud of where i came from i was born and raised in the boondocks 3
1,3,Makes me fuckn sick that everybody abt 21 and younger think that keha started the all so famous 80s rhyme style that she uses in her song
2,2,charlottegrace9 trying to figure this out haha
1,4,Ask me the WEIRDEST question EVAR httpformspringmeagentshawnee
1,4,SteadyMoneyBGB LMAO  U STUPiD  DONT CUFF DOE  CUFFIN IS FUH LAMES
1,1,Citizen advisory committee forms httpcligsdvY9A
3,1,ATTENTION ALL MOMS Join our team of Moms working from home and loving it httplyndellprospermyworldmomscom
1,2,Always seem to enter trades too early and exit too late httpbitlyHqjfZ
1,1,How To Make Your Own iSandwich 4G httpbitlybt86cH
2,1,Qwhat kind of female do u see your self marr Asumone that will make me happy smart indepe httpformspringmeWETOFDPBq249826276
1,1,RT RowettaX Manchester Intl Womens Day I will be performing at The Monastery Gorton at 430pm and The Pankhurst httpbitlyb13d8j
2,3,RT JulianBaker3 Getting a little better at physics everyday lol Im proud of myself ugh I HATE that damn class haha
1,1,New nightclub will open Friday Building owner Smith Walker center and Airon Wallace right listen as lighting  httpbitlyaSOJf2
2,2,somebody please tell these niggas aint no ho in methey taking all these shots but aint no holes in me
1,2,QIm following you D Astalker much im rather scared can you see what im doing too S httpformspringmeRebeccaFTMxq253164842
2,1,productive day all days B
2,2,Sometimes no matter how much faith we have we lose people But you never forget them Its those memories that gives us strength to go on
1,2,clau76 think i should go to bridge and fall down
2,2,Hope u shit on yaself RT Nanadabaddest Eatn oatmeal b4 I head 2 wrk 
2,2,Alchill i meant smoke srry lolbut idk i guess is this kinda reverse psychology thing every1 always tlk bout follow so i said opposite lol
1,1,RockstarGroup Undercover as a Rockstar mentee Check out my latest blog post here httpbitlybfiRO1
2,1,RT thelovestrings whats meant to be will always find its way 
1,1,Back home at the ranch should I study or sleep
2,3,Dude The bachelor so sad i started crying lol
1,1,Whos buying canned chili and not eating it immediately
2,2,I refuse to get high blood pressure wrinkly my face or get hoarse for you Just watch my footwork Love always felicia
1,1,If someone makes me this outfit male wizard from Diablo 3 Ill get my chest waxed httptinyurlcomyad2q54
1,1,Indianas organic farmers compete for 767k in federal funds under a push to encourage conservation httpowly1dpjE
2,3,illmaticTokyo Yeaaa I feel itNiggas in the south go bizzerck in cold weather LmaoI step outside and its cold as fuck Lolnot warm
1,1,Group TIMEWAVEZERO2012  Message Purple Skies TIMEWAVEZERO2012 Utopia Apocalypse or Business as Usual
1,1,Why Google makes it easy to leave Google Ars sits down with the head of Googles Data Liberation Front to  httpbitlyc00Ycj tech
1,1,LiveCamCash Launches CamWithCarmen XBIZ Awardnominated affiliate program LiveCamCash has launched the solowebca httpbitlycMBSyI
1,2,JeremyLevine but i imagine to the Jack  Jill set I had missed some common experience that theyd all had as well
1,1,httpwwwemolcomnoticiasnacionaldetalledetallenoticiasaspidnoticia401196
1,1,NurseDriea u had already went to sleep when I wrote dat
2,1,klconover I find it interesting that there still appears to be some level resistance to learningusing social media tools schieffer
2,2,The stores on my patch of Staten Island that will never go out of business liquor stores Korean nail salons and tanning salons Sad
1,1,Earn 10000 a Month httpbitly7rMOfa 1055
1,1,Ahahahaemg boongngetest doank DRT andreliciouz Hebat Saya seharian jaga meja regissRT Melihat B 88x H cont httptlgdd07d2
1,1,From a hospital CIO applies also to lean  RT iHealthBeat Halamka Standards are not imposed they are adopted HIMSS10
2,1,I like USA and GB and CA and AU but do You like My country Hungary But why
2,1,Yet be mindful of the Books you read too Manifest1 Well JustSayin
1,1,some hints for applying to public service jobs httpwwwfinancialpostcomcareersstoryhtmlid2607546
3,1,theburiedlife hey guys do yo by chance know when the new tshirts will be sent out Thanks TheBuriedLife D
2,2,RT JubilantHeart I am more afraid of my own heart than of the pope and all his cardinals I have within me the great pope SelfMartin Luther
2,1,FREE tools to help you with your business opportunities httpihidusiahas
2,1,Gay Mothera homosexual male who you look up to will guide you in the right path will be a maternal figureI need a gay mother at Howard
1,1,secondstar05 httptumblrcomxcz6ykykq
2,1,City council elections in Holland tomorrow Good luck to all my Twitter and FB fans who r running Still havent decided who Ill vote for
3,1,RT THON Thank you for your support CongressmanGT We really cant thank you enough THON
1,1,New blog post Get TargetedWebSiteTraffic By Using YouTube httpyournetbizexposedcomgettargetedwebsitetrafficbyusingyoutube
4,1,nowplayin Pretty Boy Swag by Souljaboytellem i loveeeeee dis shyt goes suppa suppa hard
1,2,def True RT ShotOfGee  Alot of girls have no idea wht the definition of wifey is Then wonder y guys act the way they do
2,1,JacobxBlackx Moans losing myself in your kiss sliding my hands up your shirt taking it off you and letting my hands roam freely
1,1,Vanabode Camp Travel And Live Forever On 20 A Day httpgooglfbCFur
1,2,isanaka fact that every act prior to Goodie Mob was trash both on Twitter and at the show Ye shurg No one ever steps to me Its
2,1,am exited my best friend Eyeisha text me the other day
1,1,NOW PLAYING Patrice Rushen  Watch Out FUNK httpdeevaradionet
3,2,AshWantstoRock ahhhh I cant wait I still need to get the cd let alone listen to it lol
1,3,I hate bloody PCs Ten minutes and still unable to log on Buy Macs people
2,2,1000 Walmart Gift Card Limited offer See Details httpbitly98ONH1 shininghongstar Asian Network BBC Chile
2,1,RT andabogdan RT worldprayr RT BarryMoore2010 In bham please pray for Heathers dad
2,3,AngeloSurmelis hey You should got in touch with me U could have come in and pushed your product SurmelisFAIL 
1,2,Awkward dinner moment Molly and I get plates dan doesnt
2,1,RussFrushtick There are about 50 people playing they just bunch together Ill be on in a bit if you want to squad up
1,2,Am I really becoming the woman God wants me to be or stuck in this rat race of life trying to become what I want to be
1,3,RT marykayhoal If you get this message somebody wrote something about you in this blog here httptinyurlcomyauj2fw Dont click the link
1,1,NCAA Sets the Example for the NFL httpbitlybsQjbD
1,3,dougiemcfly im not even beating you in tweets O  few more to go
3,1,deniece awesome busy playing with 2nd generation of the grandchilds All the 6yrs and below 
3,1,eating some strawberries  And Trevor just came over  
2,1,20 off coupon this week in my centsible shop for these awesome MelissandDoug pattern blockshttpbitlybmnCje Code Centsible20
1,2,I didnt really think that you and Kamy would last being best friends
1,1,RT Idothat2 RT if you talk to your pets like they are babies idothat2
1,1,RT flipbooks US to Reveal Rules on Internet Security NYTimes httpnytimsdCic1f
1,3,heyynodzz who were you talking to in the last tweet CAUSE THERE WERE NO S
1,1,4 Evenflo Baby Go High Chair Limeade httpbitlyddpMvr
1,2,illneverusethis also I drank half a liter of crown during the wedding so I didnt make it to the after party
1,2,RT Crucial101 uknowubroke when you know the McDonalds dollar menu by heart
1,1,RT VictorRib E a semana comea muuuito bem Acordei ouvindo The Fraktal  The Runaway Things From One Of My Dreams httpbitly4LiLjI
3,1,OGKingShootah I feel you As long as you gettin to the moneyyy I understand lol
2,2,RT jeremymckinnon Just checked into our hotel in Hong Kong China is pretty awesome Wish we had some more time here
2,1,Lol awesomelulu has a groupie Lomage httpmylocme4m4w3
1,2,TheBAbyAintMiNE wait  bruh come harder  you couldnt measure with measuring tape  what about a caspers hotdog  tigers list of women
2,2,dawg i be ruling theze str33ts bitch dont go h4ting on m3 b3cause you  YouTube httpyoutubensmLAjaKZbca
1,2,Off to watch the rest of Brideshead Revisited Le sigh Matthew Goode and Ben Whishaw I miss British men
3,2,justinbieber please tweet me i have to stay in hospital over night it will make me feel a whole lot better pleaseee
4,1,jaredleto I hope you kept those Red Glasses I threw them on the stage PS GREAT SHOW
2,1,ItsBriannaGomez yup Ill twitpic it to you tomroif u want Im on my iPod  so what u doing
2,2,ive been learning to live without you but i do miss you sometimes ive been trying to get down to the httptumblrcomx3b6z90gr
1,3,Awkward Ranger called me Williams Daddy  I replied Im just his special friend Seriously Kendal babysitter is much less creepy
2,2,rememberwhen truth or dare and hide and go get it where too fun Too grown lol
1,1,WootJustinBiebs Not much just laying on the floor You
1,1,Stars protest 6 Music closure VHR MEDIA BBC IV with Keith Allen Daisy Lowe Jamie Winstone  httpbitlybySErI  login to download
1,2,walking into he office later would take a whole load of strength so its best i go recharge now
2,1,sassyele lol Ok Ill meet you 13 of the way from my end Ill be seeing them elephants by then for sure 
1,2,You know when that last remark trails off into the depths of slightly uncomfortable
2,2,elishalyx ELISHA if you really wanted to know i doubt you do anyway ask me online 
2,2,AlterK no solid French dates at this stage but its in the pipeline
2,3,Heres a piece of advice for any and all ethnographers Avoid putting the word savages in your title Makes me hate you from page one 
2,3,RT MrMischief bondagebaby so you havent cum in a whole week You must be ready to explode when I did it the pain felt alittle good
1,2,Mark 838 If anyone is ashamed of me and my words in this adulterous and sinful generation   
1,1,Wah ada yg magabut RT japankyku NGASKUS dulu ah Masuk FJB
3,1,veganatalie An extremely bright ISS will cross your sky tonight It comes up in Southwest at 733 pm Details httptwisstnl13857
2,1,skymoviescom Good shout though Im a sucker for Rockstar Energy Original damn thats good elixir
2,1,GTG Will do a project in History I want it to be done right away
2,2,onthaRocks haha riiight and yeahh that shiz hurttss i wanna get a cute on like the one next to the ear but im scared lolol
1,1,RT martisunshine 3 moms11 kittens 14 pull fees350 RT carsoncats Have Foster But Nd Funding httpbitlybQrjli adoptapet cats cat
1,2,1 i thought i lived in the south 2 i thought march was like basically almost spring 3 why the heck is it snowing
1,1,httpwwwluanovatwilightcombr
1,2,sofauxboho I no longer drink enough  to think youre witty
2,3,he say he love me and he should have never fucked upi said o well pussy boi this new nigga jus lucked up
1,1,wherever you can stick me in let the record spin
1,1,lydiiad HAZEY EU QUE RASGUEI SEU CU COM UMA FACA SUA FOCA IMPETULANTE COM CHEIRO DE SARDINHA s
1,3,RT TeamKenielle If they seem like jb fans Im just telling them not to spam Spread the word ONLY PUT IT ONCE PER TWEET SoProudOfYouNickJ
2,1,RT Ala4adam Dont forget to text PLAY LAMB at 55100 so Adam can make the Z100 countdown tonight
3,1,Our dance contest sponsors are Twitter Superstars Watch our video and learn more about these fantastic companies httpshorttoq9me
2,1,edenfantasys who is it lol I wanna know
1,2,verylazygarlic would prefer to have my garlic peeled and not my eyes
1,1,Greader FiliPra Mega Listas Todos os bancos de imagens da internet httpbitlyc1aRgS
3,2,You have me hooked Too bad its the end lol RT veerayy good game WV back to the bachelor
1,2,donttrythis httptwitpiccom169rju  Ya it would get kinda chilly with the cargo door open but Im from Canada we just put on another
2,2,A wise girl kisses but doesnt love listens but doesnt believe and leaves before she is leftMarilyn Monroe RT suthisak
3,1,TreySmith83 Ahh yes the boiled pork The microwave was probably my favorite Charles moment It smelled like cotton candy Way better
3,1,Win Naturas Ultimate Pillow ARV 120 for the BEST nights sleep thxmailcarrier from naturaworld httpbitlycJypqN win giveaway
1,1,ceeeesinhaaaaaaaaaaaaaa matador live on httptwitcamcomgxoh
2,1,I favorited a YouTube video  Modern Warfare 2 FPSKyles How to Play Sabotage Like a Man MW2 Gamepla httpyoutubertmDv0aheSka
1,1,ILL BE COMING TO YOU FROM KANSAS CITY MOKS on Poetry by JaMeeLah will air 0313 httptobtrcoms940003 BlogTalkRadio
2,1,OH yes RT LaBellaLeigh How about we just push Emilie aside and replace her with KStew okay Perfect
2,1,RT STLScorpio31 One who smiles rather than rages is always the stronger Japanese Proverb quote RT STLScorpio31 One who smiles ra
1,2,RT OMGIKnowRight WHEN I READ CAPITALS THERE IS A SHOUTING VOICE IN MY HEAD OMGIKnowRight
1,1,nowplayning  paramore Thats What You Get
2,1,Listening toBaisdenLivemy three year screams hey mommy its Michael JacksonLOLthis is an old school girl then asked me is that the OJays
1,1,bristolskyblue neilflan by my count only one player can guarantee his starting place on June 12th any advances on 1
1,1,RT chloelecool Get drunk like an expert httpwwwvtravelledcomfeaturesarticleLondonsTop10SpecialistDrinkingVenues83266078501284251
2,1,Labels Say The Use of Social Media Is A MustThe music industry has been gaining ground in their attempts of  httpoohjacomx7ZRS
1,1,hh324 httpkingsoukutucomtwitnwaroth  shuzo
1,2,is annoyed a character in the James Bond film Die Another Day is the first result when he searched Zao in wikipedia
2,2,swaggar3lla Im mad woozyugh I need a hug smh beingsickmakesyouweak literally lol
1,1,BEFORE THE BELL US Stock Futures Higher MA Action Continues httpbitlydeBsWF
2,1,RT Social Media Guru Awesome  doesnt he look like Mark himc httpbitlygcr1y
1,3,Darn course packs lab coat and glasses 
1,1,And it is about the thing mentioned in the post description
1,2,Yall think its too early to change my pic for wardrobeWEDNESDAY 
1,2,Cant say its a surprise  Egypt score Fabio not impressed
1,1,KianaChante thats what I said Im printing everyting
2,2,Success is not the key to happiness Happiness is the key to success httpbitly9pyhm8
2,1,RT theellenshow Samesex marriage was legalized this morning in Washington DC  hopefully other parts of the country will follow their lead Go DC
1,1,Bootifulblkflwr isnt that a bomb outlook expressed in that quote
1,3,ugghhh going to be in so much troublee
1,2,RT bieberinmypants take a chill pill i dont think Caitlin and Justin are datingAnd if they are than its not a big deal forget dra 
3,1,Cant wait for the paraolympics 
2,1,Sukumar Azhikodu on Sachin hit 200 Sachin shud retire from hockey fakingnews D My last tweet
1,2,Forsureitsdb why are you gaining weight
2,1,GarethBRUTAL me too S
1,2,I can see why CA is bankrupt as a state Look at all the racist fools that attend universities there  and the people that support them
2,1,Burning Legion The Horde successfully attacked the Alliance Next battle 338 AM
1,1,RT crystallineree RT MossAllDay shOutOuts2 livnpruf27 crystallineree llalypop MILK85 Tee622THANX babeNo prob
1,1,Look4Articles Web Marketing Network Act Wisely Building web marketing network businesses that can offer httpbitlycseicV Visit Us
2,2,iREFUSEto be an asshole towards women even though thats what most are attracted to if I do meet someone whos into that maybe urnotforme
2,1,justinbieber please notice this httpwwwyoutubecomwatchvIF8DVTR8cvU it was made by a proud belieber not me iTzbiebershawty 29
1,1,jobs MedPed  Morristown TN US MedPeds needed  flexible practice scenario  beautiful east Tennessee Lak httpbitly9gQ4us
3,1,MrsPinkyIvory pink sweat suits frowning up n every pink sneaker n everything pink from lol girls I know I did lolol Im true to my pink
2,1,John Barnes Wayne Rooney And Steven Gerrard Are Englands Two Most Important   goalcom httpbitlyaVoPI1
2,1,I just so appreciate my Tweeps from across the pond They seem to understand American culture as much as we understand theirs anarchyUK
2,2,PaytonHeaney Hey sweet u unfollow me O 
1,1,Hot 155 Adsense Ready Adsense Powered Sites httpbitlyb2YDZg
1,1,Im broadcasting on blogTVcom now come see me httpwwwblogtvcompeoplelilmaggie
1,2,have i done much of my journal nope what a waste of an hour
1,1,the erroneous funk httptheerroneousfunkblogspotcomspreftw
3,1,cricepr Good for him Im a DMV nativesaw him from his humble beginningsso glad he put gogo on the map
1,3,manigjr oh dang i wish i could just go to the globe and buy one but above sucks 
2,1,meeranagaraj Hi Meera nice to see you here How are you Where are you I am with your previous company  Wipro 
1,1,Twitter adds to Dalai Lamas virtual virtues httptinyurlcomyjjq8yj
2,1,IRunToLove Will you please scratch my back 
2,3,alkerton I would have answered YOUR HOMETOWN ASSHOLE to that last one Just for shits and giggles
1,3,the IBS show is coming up they are soooooo gonna break my pockets
2,2,Lmao Funniest Shyt I Seen 2Day RT SiMPlYFlAWlESS thomasinaa told starshaa johnn dick dont qet hardd muchh cont httptlgdd66nt
1,4,RT MonStarMimz RT violetnight F A S H I O N yeathatsmyshit U knw this RIP McQUEEN Ledgend
2,1,RT AngelaSimmons Laughter is the way to my heart 
2,2,MiikeLowery LMAO Im CeCe but iamAbnerTaylor is my only Twitter boo Sorry
3,1,Saying good morning to everyone Another gorgeous morning in Surrey Wishing you all well
1,1,just joined a video chat with 43 other people at httptinychatcomthepartyyy tinychat
2,1,My favorite song Communication Breakdown By Led Zeppelin Is playing on WRAT Listen now httpstreamwratcom
3,1,RT trudydehacker six sixes in an over 200 runs in ODI 10 wickets in an inning max fours in ODi max runs in ODI and test  all records belong to INDIA 
1,1,AZ news Ariz House votes to try using tires to fill mines httpbitlycUof8d
1,1,Portmeirion Apple Harvest Wall Clock httpsnipurlcomulifj
2,1,I really think this past weekend has made me realize something that i never thought possible i think it made us closer than before
2,3,just a random day in Belgradeplaying with little ones  missed them a lot my dog  toy poodle Pierre and sisters dog Leo
1,2,TonJonas my car actin stupid i think my power steerin bout to go bad look
2,1,RT shianne MrSoloDolo3DH I want em I think me tawpteam3dh Aniya and ant jr gon get em then all of yall just cop em lol
3,1,JadeTeamByrne What colour are they I NEED some new shoes lol x
1,1,Current Disneyland Discounts  Special Offershttptinyurlcomya2uh6j
1,2,RT 9KayBeauty0 Dis gurl said she got pregnant to get attention smhthingsBASICbitchesdo
2,1,Watching Toy Story In a better mood already 
1,3,AntiSocialBitxh i aint THAT slow 
1,3,Is it Bad to Have es Type off feelinqq when you aintt Aroundd  Missin Baby   ets kindaa retarted i havee too tell yuhrr sisterr fahh yuh
1,1,mitzihotcakes httpwwwmyspacecomntiemann
3,1,I luv gang of roses wit lisa ray  stacy dash I luv them ma fav actress
3,1,My favourite place in the world RT GuardianBooks Shakespeare and Company a creative sanctuary  Stephen Emms httpbitlyc2DH1R
3,2,RT highlandwhite without a spotlight you speak your mind and by golly you get results not for fame or the big I am purely for another human you see in
3,1,Im hosting this weeks BSI Wait for tonights ingredient reveal on my blog D
2,1,httptwitpiccom16bbjc  The night would not be complete wout a trip to Sephora
2,2,The only true wisdom is in knowing you know nothing
1,1,MMA event Friday at Park Place Dome httpbitlybCZvQz
1,1,Can the Dodgers Make it Three Straight NL West Titles in 2010 httpbitly9BL0As dodgers mlb
3,3,Lookinggggg A HotMess Still Want To Seee My BD Though I Lovee That Boy
1,1,Comparing the new Windows 7 versions httpsupr2frbo0
1,3,This weather is shitty it is so effing slow at work and I am beyond bored Pretty much bored to tears I should probably just do homework
1,1,article about how support over pay keeps top teachers in classrooms httpowly1dR12
2,2,lmao my fable for english was awesome it was about a hawk lying to a penguin saying it can fly etc lmao still penguin you cant fly P pats
1,1,tyrabanks pls RT and watch officialcharice Pyramid Music Video httpbitlyaUqiA6 Oprah  David Fosters protege
1,2,oneofmyfollowers jst made me hungry wen dey t0ld me wat dey c00ked
1,1,Im at AyeBloodyRights Domain Danes Crescent Glasgow http4sqcom9oZR1S
1,1,QKENAPA JOE JONAS Asoalnya cakeeeeep  httpformspringmekikeeeeeyq257034549
1,3,This one Or is my smile gayyyy httptweetphotocom13139779
2,3,RT OlDirtyDennis realthugs dont eat icecream on a cone ever Lmao
1,2,Dynamite619 Im just goin play zone cause its obvious that u cant win when someone plays zone against u
1,1,One bedroom apartment with bay view berkeley north hills 1300 1bd SFO cl realestate rent httpbitlycQy4U9
3,1,Jason does not have a farmville because the government pays him a subsidy to not grow imaginary bullshit  I love my friends
2,1,Everyone seriously needs to get liltunechis rebirththe mans a genius
3,1,Listenin to some of my old songs laughin LOLwhats funny is i shopped some of these WHOA hahaAlways been mad confident lol smh
2,2,bensonjunior ok then well sorry that i havent been able to breath all yesterday and today to be able to call you
3,1,Its time Home sweet home
2,1,Tweeple n specialteams mates hope youll stop by and check out the ning I created for all of us httpspecialteamsningcom
2,1,I favorited a YouTube video  The Big Bang Theory  Sheldon Bazinga  httpyoutubesiWh5qnpclka
1,1,Rated 96 DECEMBER letra SHADOWS FALL  Letras de Msicas  eLetrascombr  httptyntme3tEp
1,1,Green Building White House Releases Fact Sheet for HomeStar Energy Efficiency  httptinyurlcomyj7sokq
1,2,RT StylezP mylioness who is this asshole tryna diss people on twitter just what you said An asshole hiding behind a name girl
1,1,The Denny Hamlinmedia feud that wasnt via Twitter httpbitlycL5CvY  NASCAR
2,1,Fantastic Forex Latest Forex Converter Yahoo Au httpwwwforextradingautomatedrobotcomlatestforexconverteryahooauctions4html
1,1,Morniing ayymakasiiRT veliimar Morning all Have a beautfuIl thursday Cpet sembuh yaa saiiank miss you 
2,2,is buffalo dat wack that I just had to be smitten by sum1 dats in NYC really thou really
3,1,Thanks means a lot to the volunteers who have grown it to this point RT sav01 mpaynknoper agchat  very impressive in my opinion
2,1,Jehremy Youll be seeing this soon enough too and agreeing RT Jchawes Craziness httpyfrogcomjpqdasj
1,1,Worldwide RT AdeleMcAlear Question of the day What location do you have your Trending Topics set to httptwtpollcomzvt31w
1,1,QWhat music are you listening to today AJustin bieber httpformspringmedestinyh1316q256922151
2,1,joeymcintyre the dipance is youuuuu is possibly my favorite part of Griffins music video He really feels the music Adorbs
1,1,After Elvis Presley hair it now fashion outfits of stars Designer wears that wrapped Michael Jackson Elvis Presl httpbitlycAwBYg
1,1,RT Bonezine  QT scarletwasp  RT kizall httpblogsyahoocojpturiwato10229014html  httpt 
2,2,im out of popcorn and only a small bit of toast left I want more toast going to make more toast in commercial break
2,1,everythings better tilted RT vtravelled A day in the life of New York City in miniature httpvimeocom9679622  NYCEDC
3,2,RT DJFRANZEN Thankful and humbled for another day of Life It is truly a blessing Never take life for granted Live each day like it was
1,1,All who saw the FAMUSexTape MUST follow and review the timeline of  RT freshalina This would make for a helluva episode of Man vs Food
1,1,AMAN ATHWAL collection latest write up Bangs and Bangles httpbangsandbanglesblogspotcom
2,2,making my sister walk on my backk baha needs a good crackinn
2,2,BillsAttention really omg At me was not bad But I think that could will be better haha and how you feel today
2,1,RT fentylovegood 060 from 365shots  Show your love  httppostlyQWyQ
1,3,InsaneSteez and fuck it if I misspelled my last  comment to you my bad
1,1,RT JonasJoeWorld RT if youre in the JonasFamily and you want JonasBieberPEACE  And dont forget to think of cont httptlgdddqib
1,2,RT theonlinemom Although we report on the studies we do not believe video games are the cause of violent behavior in children httpbitlyUbVoM
2,1,i like that game better than the usual i spy my credit card at revival i usually play on sat mornings legendsleague
3,1,louiehiguera Waddup brotha I needs to get my Twitter chops up 
1,3,RT crazimonkay Lamatrix RIPMadisonBieber Unbelieveable Just because theres a Jonas TT like that Wow Justin Bieber fans are PATHETIC
2,2,i dont care what johncmayer says in his interviews his lyrics  his tweets make me smile i feel all warm  fuzzy on the inside
3,1,RT iamdiddy Attention paris I have a party at club VIP on thursday Lets go Spread the word Last cont httptlgdd7v83
1,1,RT twirusnl RT mjmulders1989 Help mee om een representatieve Twexitpoll te maken en ReTweet Twirus Exit Poll httpbitlybEG4LA
1,2,TheRichLane What up Bruh Bruh Yo Im bout to order them Ray Bans twitpic ya jawns for me Im not sure if mines is the right ones
1,1,mersilavie httpwwwgamagocomproductphpproductid16962cat279source100302blast
1,1,Now you can text to help people affected by the Chile quake News httpbitlybuQwzL via addthis
