mean pos,mean neg,Tweet
1,1, eating popcornLondonRain1913 We wont tell
1,1,solets say Id offer a profile pic for a 50 donation to a charity of my choice Takers ive done mine partray and wccogal 
2,1,essdogg 3 Favs Your tweet has been favorited by 3 people httpfavstarfmusersessdoggstatus9559303051am
1,1,RT ThisIsSethsBlog Seths Blog How to use clichs httpbitlycJl0ku
2,1,RT StarCreations RT dutchfeltart GlassRiverJewel Sweet Spring httpbitlyczZKl3 etsy wwes
2,3,LilPhilty lol if thats what I meant Id admit it nigga Haha
2,2,Groundhog day may finally be over Today is my last day of class Big deadlines tonight
1,2,lies on top of lies smfh
1,1,Viral video Wade Phillips YMCA in Miami If you look really hard you can see Drew Bledsoe crying in the corner httpbitly9HR1rB
1,1,Check Out Rock Band Guitar Skin Fits Xbox 360  PS3 Stratocaster Guitar Zakk Wylde  Bullseye httpbitly9K7zOv
1,3,I NEED 30 more min me sleep but I guess not  cause that would make me late to work
1,1,MCMD Illustration httpwwwflickrcomphotosmooselumps
2,1,I thought Didi Benami did very well 
1,1,RT smashingmag Twitter users send 50 million tweets every single day  httpblogtwittercom201002measuringtweetshtml
1,1,roll call  who is here on this rainy day  httpbitlybEtom2
1,1,Hoste Rooms Full BC technical web comic httpfullbcinindexphpcomicid70 via addthis
2,1,wordtoraven Alright then Thanks
1,1,Kodel auktasis mokslas usienyje tampa toks patrauklus Tarptautines Europos organizacijos Dream Foundatio httpbitly9ZhMuX Balsas
1,2,bevysmith You are watching a nervous breakdown in real time
2,1,httptwitpiccom1501qo chicken n guacamole the rest of the dish is still cookinn i didnt deep fry da chicken its baked
1,1,Check this video out  Progressive Ad httpyoutube annschild7 please vote for me Thanks
1,2,I need to bring up my grades Bahh
1,1,I just got some FREE music from Joy Williams You can download it here httpswwwnoisetradecomjoywilliams
1,1,SilkLi I see Up and about or still wrapped up in sheets
1,1,I have added La donna e la sua ombra to my aNobii bookshelf httpianobiicom350e42
1,1,tembang pagi hari ini Gugun and The Bluesbug  Woman
1,2,It is hypocritical to pray for victory over our sins yet b careless n our intake of the Word of God  Jerry Bridges httpmylocme48QeI
1,4,It would appear that my account has been hacked FUCKERS
1,1,RT mrbones305 BRE presents Blood Raw AMERICAN GANGSTAS da mixtape httpwwwlivemixtapescommixtapes11206bloodrawtherealamericangangstazhtml
1,2,jallah adamtwentytwo Andy Hundly got head for 5 and then punched the girl in the face left her 3 and dipped Rtrtrtrtrt
1,1,RT dawnlilly RSVP HERE  httpcaltweetcom63u   Miss MINI of Pittsburgh Spokesmodel Search ReTweet Please
1,1,READ The Legacy Of Che Guevara Internationalism Today via Peter Custers  httpbitlycLLQD4
2,3,lol bobby you a fooll ANYWHOO lol hoppn in tha shour SOOO bbl NO PHONE TIL SUNDAY
1,1,OSU players talking confidently about UCLA USC games  Omari Johnson said I think we can win both of them
1,1,Download iBusinessPromoter IBP 1171 httpmetadownloadsinfo20100224ibusinesspromoteribp1171
1,1,RT tedtalks Todays talk from TED 2010 Autism activist Temple Grandin says the world needs all kinds of minds httpontedcom8A29
1,1,New Music Rhymefest  Skyzoo  Crack The Code httpowly1aBUI
1,1,httptwitpiccom153rou  Nokia was here and all I got was Blue Balls
3,1,PaulaXFactor Thank you  I will do it first thing when I come back home tomorrow  x
1,1,desi4love whats up what u getting into
2,2,oneofmyfollowers likee me I likee one of em Andd one of em wnt get off my BACK
2,1,Kenasha I cosign lol
1,1,1 5       2102011 httprakutenshopdipjpiiamazonnew20100224B0035ZXV5IHTML
1,1,Gate Attendant TXHouston Are you searching for an opportunity to be a part of a team Do you find it important httpbitlyaRfYJ5
1,1,Remy Ma Interview w Jenny Boom Boom And Dj Craig G  httpdjgonetvvideosvideo1108
2,1,Lopez tonight baby httpmylocme47uXg
1,1,AndeGregson how did Perth go  all to plan
1,1,a year ago today sunrise over the harbor in Annapolis Maryland httpflickrp636nq7
1,1,Pork Chops stuffed with apples and scalions fennel roasted potatoes and what winefirst thought was Riesling
2,1,thetwatwaffle I always say twat muffin thats kind of like twat waffle lol
1,1,Achxsel guck mal wer in der Playlist drinne ist  httpwwwbetonblumecomsitesbb003html
1,2,writerinmydream they dont really scare methey are def going after big fics
1,1,If you go to hell not to worry because you will be so busy shaking hands with all your friends that you wont have t httplnkms4mw3X
1,1,Get a sneak peek at the stage production of The Drowsy Chaperone video httpbitlyajZcRD
1,1,Getting Around Venice  httpwwwfindyourarticlecomarticlephpid245
2,1,eddiemunchies can you tell my mom to be here at 215 please
1,2,vocarosia for some reason dies D please dont bury me with the mask on
1,1,teodoroo kkkkkkkkk Darth Lia boa hauhauhUHHIHHIHI
1,1,Does teaching lowperforming and highperforming students httptinyurlcomyb63a8e San Antonio Childrens Academy
1,1,Martin Creeds marble steps hit a stumbling block httpbitly9VLcRN
1,1,Going on since 1008 I am at my witts end Started looking for help way back in Oct of 2008 We are in a 675  httpbitly9q95vM
1,1,For you night owls go check out the Technolationship httpuniformkayoswordpresscom20100224technolationship
3,2,I am finally the proud owner of my own PS3 I have some other things to comment on but this is the only positive
1,1,Im surprise WilliamHTho remembered a quote from me
2,1,RT Go get a copy of SomayaReece TRAMP its on tunes httpbitly9Qx388 only 099 cents
1,2,3Downing these alcoholic shots I feel numb and desolate My senses are starting to rest Gentle Mimosa
1,1,RT Hisyamn artis indonesia banyak tuh kenapa pada ga verified account ya
1,2,Lucia316 you are typo guy today one in your tweet and one in your 2nd paragraph
1,1,joeyishellagood probably this ones going on 4 years
1,1,Indianapolis prepares for March Madness with new hotel rooms vacation packages httpbitlyahrtcj
3,1,mvrk122 Thank U I learned so much from you during Urban Mission You really have taught me SHOWN me how to have a personal evangelism
3,1,Going to Vampire Weekend in may with Nora D
2,1,I just updated my background at httpTweakMyTwittercom Also Customize your Google Start Page at httptweakmytwittercomgooglephp
2,2,I cant stand my hair anymore so ima go to the store  buy hairdye
1,3,Trying to send 1 last email for the night and the documentation is taking some 20years to uploadam ah get mad
1,1,RT ChiggsLtd New blog entry Its one thing having an idea but httpwwwchiggscoukblog
2,1,qfishchitown wow I can See you  WAVES 
2,3,RT xxArielNicolexx Omg hates when it cold because your nipples show through your shirt Ughh covering my chestlol Lmao
3,1,WooooowIm listening to this reference I jus recorded on units and I feel like partying RIGHT NOW Lol dbtrakz got haute beats
3,1,Come on team you really rock Check it out I have a cock LOL I fukking love Robot Chicken 
2,1,Codysshort ill be your friend cody
1,1,Ascendant  MediumCoeli for Ankara TR for now 04h30m01s UT 0351000 Pisces AC  1533357 Sagittarius MC
1,3,SianyLou88 bastard shower
1,1,Take Your Time in Love and Sex For Better Flirtation Seduction  In my own case as the guy I was dating at t httpbitlycATN7K
1,1,Get some rad new wallpaper from National Geographic httptinyurlcomy99bvrs
1,1,RT MyTakeRadio Check out My Take On MMA as an Olympic event
2,1, and then I shared my score on Facebook  re How Millienial Are You quiz httpbitlyaT3cc1
1,4,imtiredof this SNOW and COLD weather
1,1,liked You cant manage online ad inventory like a stock market George John is CEO of display advertising technol httpbitly9h6mON
2,3,im gettin uuber pissed huggies i won their contest and now they wont follow me so i can get my prize
1,3,imisspekkle I havent heard from you or seen you on for a long time I miss you
1,3,Ok gnight peaches I shouldve been asleep at 9  6 AM wake up is going to suck
2,1,Mmm I swearr carls jr has the best chicken strips
1,3,Anahi is the worst thing I have ever seen in Via del Mar Let her know she is dont sing lol
3,1,Counting down the hours to Spiaggia Thank you Chicago restaurant week 
1,1,28 of energy consumed in this country is transportation Think our electric grid is ready to take that on
2,1,Have dinner plans May we recommend dining at Sole Mio The Nashville restaurant will donate 50 of tonights dinner sales to AliveHospice
3,1,RT NEWNEWBLONDeD VansMarley WONDERFUL AND U
1,1,Eh httpmylocme47mHw
1,2,Miss Beverly Hills thinks homos should be put to death but she has a lot of gay friends Im thinking not anymore httpowly1azwG
1,3,Themopinator Not sure of those details but nothing gets my blood boiling like property taxes pure theft
1,1,RT danielparsons The Latest News About Free Twitter Videos From Danielparsons httptinyurlcomyfdzlrm
2,1,RT time TIME httpowly1pcDhh is college really nec for everyone I say forget about BAnow you need a MS to get anywhere
1,1,So century 21best buy coming to KPwats nxt Gucci Express
1,4,RT FUCK ALAHISLAM and MOSLEMSRadical cleric calls for mass execution of political opposition httpisgd95j29 isreal IranElection
1,2,RT teesdatcutie Stupid meeting smh I dont even kno wat its about
1,3,Is super sad you leave tomarrow Hurry and come back I miss you already
1,2,Swine Flu Not Over 10000 Steps  myfoxnycom httpcligsMjvYN swineflu H1N1
2,1,papercoversrock Find one that is fun and full of the information youre seeking Youll make good connections and come back feeling great
1,1,Im at MobilMcDonalds Rt 95 Madison http4sqcombxrBzS
1,1,staceylt We will never be the same thanks to chibijeebs
1,2,my back hurts
1,1,RT JudysDesigns RT LauraBijoux Take a look at my Dream in Pink treasury  httpbitlycE5ZlS wwes etsy
2,1,im gonna go dry and fix my hair and then call adam 
2,1,LittlecBeadles I would like you to follow my bieberbuddy BiebersSwagg 6
1,1,The Time Is Now To Create Eco Friendly Homes  Critical Online Tips If you have read in the newspapers lately  httpbitly9GLRzl
1,1,Library
1,1,RT DMVBot its2010WhyYouStill where shoe strings as a headband and lollipops in your pontail DMV httpbitlyccpAEg  lol
2,1,Hoping for no school for I can sleep all day and nighttt
1,1,Ahoy California friends Anyone have contact info for sculptor art car hero and famous Burning Man artist David Best Pls RT Kthx
1,1,The smart money is betting on transparency Where have you placed your bets
1,1,nowplaying Camp Out An Horse
1,1,Pratt  Whitney to appeal ruling on jobs shift httpdlvrit2YDF
1,1,Elite XC Back from the dead httptinyurlcomykm7gtm MMA UFC httpmylocme48zGe
2,1,Blogging for Businesses results in 55 More Traffic 97 More Inbound Links  SysComm International httpowly1aMkR
1,3,RT DeeMagicJuan MzBDominique I fell asleep in the parkinglot lmao Wtf U only had 2 beers Juan Lmao Wow lightweight
1,2,just started the chemistry homework not feeling okay
1,1,RT MX4Scott Chatsworth makes excellent cabinets and cable management systems httpbitlybLFacK
1,2,wgillis he said his spoiler was fake but it wasnt
1,2,jimharper actually the scenario ur positing doesnt work when lappy checks in from xternal IP they know its not at school
1,1,bailed after two hours of getting stared at like a celebrity by EVERYONE i know im famusssss but with the combination of no cigarettes
2,1,omgthe wall turned out looking gd
1,1,steviecarlson Please tell me you are bringing the album to the London gigs so I can buy it
1,1,Not to mention MODEL nya NORAKigh ogah gw
1,2,Now Another Team Got Problems  SMH Do Yall Niggas Sit At a Table And Plan To Suck RMG Dick Like Who Are Yew Bois  Get 
1,1,httpbitlydwBd20qgirlfriendsenlarg3menttaslesiansseductionsdeflorationblondiesdbzslesbiananakedqueef
2,3,DawnSays1 Obama needs more that a year or 2 or 4 to correct It took more than 10years to make it this bad  you are sooo rite Dawn
1,1,hai tweeteros Tak Punya Biaya Pak Miin Terpaksa Menginap di RSCM httpbitly9QFyCi cnews89
1,3,so they make life size cardboard cutouts of the twilight characters but they cant make a justinbieber one this world is crazy
1,2,georgeotiono idc sorority row still did shitty only high school idiots watched it Im sure  everyone else was disappointed cause I was
1,1,HealthBusinessvnNet Important features of mens underwear httphealthbusinessvnnet201002importantfeaturesofmensunderwear
3,1,rhaynecoleman I havent forgotten about sunday morning praise PRAISEHIM
1,2,Hattrickheavencom Newcastle surrendered top spot in the Championship after crashing 2 a 30 defeat at Derby
1,2,i remember the simple things i remember till i cry but the one thing id wish id forget the memory i wanna forget is goodbye
2,3,Sometimes my wife  I are totally incompatible Were in the Apple store and Im NOT allowed to buy an iMac  What a beeeeeech 
2,2,so much work so staying up all night thank goodness for my beatles lp
1,3,Im totally addicted to FormSpring
1,2,As many times as Ive seen the movie scream it still scares me justsayin
1,2,first thing first  well you know what guys Im still confused about how to using this page nyeeh so maybe httptumblrcomxu96stw26
1,3,so much for that im  and not because of that think ill go home tomorrow to get away from people i dont like
3,1,lexxxylives I am so very glad that you died of laughter xD
1,1,follow these simple steps inb a proven system to rake 11917 a month today httpbitly6zIWKm
3,1,RT djkingspin Good Morning ppl 4 my early birds i got new music 4 u guys  wwwdjkingspinpodomaticcom
2,1,Simpsoncody  your moving to the states  
1,3,stupidest exam and assignment due tomorrow finish survey  then continue wasting life away via facebook
1,1,thingswewantback 90s hiphopthe ones that possess that  I can relate feel
2,1,Do nothing against ones conscience With this secret we can enjoy life  have no fear of death  Voltaire quote character tinyquote
1,1,Marketing Apple Secrets of the Worlds Best Marketing Machine httpowly1bkhR Apple Do One ThingBetter
2,1,Omg I actually have a thursday night off O Movies or late night shopping Cant decide
1,1,One Cuisine for the Rest of Your Life When asked the question If you could eat one cuisine for the rest of your httpbitly90Ivv2
1,1,Listening to mikeposner One Foot Out The Door Straight HITS httpmikeposnercom
1,3,PS Taja doesnt frolic in fields I hate the smell of freshcut grass and I hate insects aaliyahMichelle
1,1,letoyaluckett hey can give my cousin a shoutout her name is Shelby and she stan for you
1,1,RT quoteminded Whats the point of having it all without the people you love
2,2,paperbatty Oh absolutely Lke journalism school Boil away all the verbiage Good discipline Painful though
1,2,Dennys has never been so great Rednecks fighting httpmylocme4a5Um
2,1,RT Idothat2 RT if all you need to feel better sometimes is a hug idothat2
2,1,I just got a new phone Loving it its an HTC hero from Verizon Im happy
1,1,Senior Financial Analyst Ajilon Professional Jobs Finance Houston httpjobviewmonstercomgetjobaspxJobID86504014
1,1,RT sabaaaaar Navielia Babi lo kesel sama orang gausah gw yang kena tai Gw bisa berangkat sendiri httpmylocme4ajJQ
1,1,RT CooperRepublic You know your making a good point when Obama cuts you off tcot
1,1,MsMartinez03 Im sittin by my phone waiting for it to ring and see ur face on the caller ID
1,1,Ok got the memory card into my video camera so thats in ready to go
1,1,my moms reading How to find God
2,1,she wants me to play with her until we fall alseep togetherso goodnight tweople shalam
1,1,Todd Field 46 httpbitly9lmAAo
1,2,Shot man was stripped and bound httpbitly9569ja
3,1,RT EmanuelKiriakou All I wanted was to get in my wifes pantsand now I have 2 kids LMFAO
1,3,calandro5 Sounds like it was very miserable I feel bad for my friends who are TCC while it seems like every other friend is now pregnant
2,2,Omg i cant wait 2 graduate and move the hell outa this state i love ya chicago but goodbye winters
1,1,I say cake you say
1,3,TheSteveWoods Hi Steve all Twitopia Yes had meeting today then hung with daughter Ian home nowam writing YUCK
3,1,NickWoodford93 goood alrite i supposee 33 up too muchh xx
1,1,Follow IamMahaganiSTAR and kayobracy
1,2,To my network news producer followersI know this is naive but while the fulllength live hcr summit makes for dreadful television
5,2,RT GreerGrammer Will isnt it sad that were gonna be remembered as a generation who loves sparkly vampires Me I LOOOOVE sparkly vampires
2,1,RT HeavenForex Howdy guys So we are starting now In a few moment youll es the first trade made by Heaven Forex developer Be read 
1,1,Okay Im officially sarvering Adam is coming to Singapore and its an exclusive gig
1,2,Bigojac2000 Im sorry for the way I treated uI was selfish and impatientthis is my public apology
1,1,Snow high winds headed to winterweary Northeast APhttpbitlyc7Usii
1,1,womenswednesday at the olympics true except for that the mens win over Russia was pretty big too
1,2,Some people are making such thorough preparation for rainy days that they arent enjoying todays sunshine William Feather
1,1,httptwitpiccom156iw5
2,1,RT TheLoveStories Cling to your imperfections they are what make you unique Debbie Black TLS
1,2,I am the rust upon your gears I am the insect in your ear
1,1,RT entlinx follow svmworldwide roccett bxcmusic
1,3,RT BriSObad youever wanted to just smack the SHIT out of somebody  OH GOSH ALL THE TiME 
2,2,The mattar paneer I just cooked didnt feel exactly authentic but the 34 cup of heavy cream it employed sure made the dish tasty
2,1,I love my hairstylist I believe she thinks Im gay so she flirts with me constantly and vigorously runs her cont httptlgdbjssg
1,1,Singing to grab yo neck and chase u down the street RT LadyReeseSpeaks nowplaying Maybe I Deserve by Tank
1,1,EaSy49erS yo I found this store that got mad classic Lo The whole teddy bear line
2,1,JGONeill Blanche Norris Graham and to some extent Steve MacDonald are the funniest characters of the last few years More please corrie
1,3,omw to this shoot and my back is killing me Wtf
3,1,Crazy to think that I went into labor a year ago today Teagans birthday is tomorrow but today brings back a lot of memories So amazing
1,2,RT channel4news Footballer Wayne Bridge has said his position in the England squad is untenable and potentially divisive  statement from lawyers
1,2,RT OMGIKnowRight Saying No Thank you to a biscuit Just to be polite and then regreting it OMGIKnowRight
1,3,Lights flickering in the office  could it be an impending power cut Save work now
2,2,MeLikeSkittles stop talkin to them strangers lol
2,3,Lasted 40mins in town Got presents Too many infact Actually soaked now because I thought Id take the healthy option  walk Hot
1,1,Post Each Woman Dreams To Lose Some Kilograms Each woman dreams to lose some kilograms To make this they try t httpbitlybnmxUk
3,1,RyanSheckler Hay Ryan why have you no real life soap anymore I liked it kisses from Holland in Europe
2,1,RT DopeSince88 im lowkey about to buy my LBs album on itunesits actually good whose album
2,2,KatieBeth Long as I can still hit you with it Im happy p
3,1,Xavieralanzbaby haha hit it up when you make a new batch 
3,3,RT SonnyDani I love when ppl just lie straight to me Dig a hole bitch bury yourself 
3,1,RT PaiSitang RT KongKaroon Thank God Im free todaytake a rest na ka  httpmylocme4a4ZT
1,1,iarafm following you follow back
1,1,GandLGuitars got my first SC1 in 1982
1,2,BrittanyLovesC Idiodd  yall still arguing
1,1,American beauty Someone is stalking you RT StefanyBaez Plastic bags are flying around out my windows 5th floor Wth 
1,1,Please ReTweet httpcaltweetcom603   VIP files FREE mixtape  Guest List
2,1,Who Else Wants to Secure A FREE Wealth  Power Building eBooks  Audio Package Including Limited Time Bonuses httpbitlyWealthPackage
1,1,The smartest thing you can do today is to pay extra attention  More for Libra httptwittascopecomtwittascopesign7
1,1,Apple Removes Explicit Option From iTunes  app store  Gizm httpmbanetwebapp
3,2,1014 of snow with blizzard conditions expected thru Friday  I would REALLY love some sunny spring weather
1,1,via wanderkeil Misprints 4th Annual Beard  Moustache Competition at the Mohawk 21910 httpbitlycADutQ
1,4,simplyme4you so you always make tweets about tila if you dont like her why you do that OH I KNOW THE ANSWER YOU LOVE TILAofficialtila
3,1,CheapEatsDotIE you could say in like a big hrny thing 
1,1,Nueva foto de Said 26 httpsoytopcomfotosshocker
3,1,DoseGambino yea dat right I run red lights I thot u new And I drive wit 2 feet so wut dat tell u Im ready playa
1,2,its only 200 runs and now i seriously feel that sachin is overhyped
3,2,BabyDangle i love that song i wish i could find it somewhere to download
2,1,RT MSJAJALOVE So to all my real females followers 
1,1,Get inside information on how to get the most out of Twitter httpbitly8ywQvZ
1,1,Will Super Mario 2 and Metroid entice hardcore gamers back to the Wii httpbitly9Wy7AD
2,2,QWhats the best place near you to get a drink AI dont party downtown so I wouldnt knowlol httpformspringmeBCOOP1q224611020
1,1,thehistoryguy Hi Dan Any truth that the first and last shots of ww1 andor ww2 were only 300yrds apart in a French field
2,2,marvwon succesful ghost writer allday fuck bn famous sho me the moneythen rappin wouldnt feel like a job anymore and i can enjoy it
1,3,cspeters sunova Im losing all my tukee mayorships since Ive moved away 
1,2,tosavemoney you cant have too many black friends they always askin to borrowyoull never see that money again
1,3,Lunch at Hard Rock Cafe a place I will never go to again My soul is waiting outside for me to finish
2,1,My Work I just wanted to share my work with everyone here I have been working on two websites that aim to help p httpbitlycHFaib
1,2,theviewtv topic for today what are the odds I think the universe is messing wme
1,1,Gridskipper After Hours At The SoBe Wine and Food Festival httpbitlybdn5PS
2,2,kelschra as much as I hate to admit it her songs are very catchy
2,1,I want some in n out frys and a chocolate milk shake
1,1,TimMcFly Epills and Gus lady friend And cory and his GF
1,1,My Top 2 Weekly lastfm artists Coheed and Cambria 58 and Lady GaGa 1 httpbitlybGZonT
2,1,Happy Birthday Swagbucks Heres to another year of free rewards at httpbitlyKdISW swagbucks
1,1,3G spectrum auction to open doors for foreign players Economic Survey httpbitly97memq
3,1,AlishaRoberts7 Hey Mamma thats more important than my videonext time 
1,1,ESPN host Tony Kornheiser suspended after attack Fashion Hannah Storm Tony Kornheiser host of ESPN show Pardon the httpbitlyaJeQzd
2,3,YumSexy i think im in a drought lol
1,1,BlackMamba8 Im in the overflow room
2,1,JoseFloresJr LOL ICIve seen itI thought they did another one
1,1,Scififanattic try httpbitly9gsGTx instead
1,1,Foul Territory Michael Kirkman video From the request and dedication line this video goes out to Kinslerhomer  httpbitlyageltF
3,1,Its time you changed direction This is the answer Itll blow your socks off httpprofusionXis4meinfo
2,1,RT prettypinkposh New Prettypinkposh Sizzix giveaway Heres your chance to win some brand new products httpalturlcomua8f
1,1,hullabalootion Heres the article httpbitlyaRPcQ6
1,1,RT taryder Confirmed Kristen was with Rob at Lizzy Pattinson show last night at Halfmoon
2,2,RT DonGucci Buy A Girl shoes  And She Will Walk Out Ya Liferite wit them shyts on toolmao
3,1,RT lifehousemusic 5 days untill smoke and mirrors httpbitlyaQrxgq 
2,1,aliciaaw002 hey hi 
2,1,RT 3greenangels Spread the word find out what is in your food and help others httpwwwwhatsonmyfoodorgbannerjsp ecowed
1,1,iPhone Game App Makes 1M in 9 Days  httpbitly9QFMH8
4,1,Great idea RT SharonDV AbsolutCJ yummymummyclub A Blue MOuntain getaway would be AWESOME
1,3,jcogliandro You moved too slow bro BestBuy
1,2,RT candacejade84 CPOLKgotdoe noand if someone say yes hook em up to a lie detector
1,1,arcktip are you going to the intermodal transit suchness this evening
1,1,foforks novo trailer de a hora do pesadelo com kellan lutz httpwwwyoutubecomwatchvdVscaWzTckw
1,2,Sitting in Italian hanging around Hopefully I wont fail this stupid conversation thing
1,2,is trynna figure out y these niggas dun gased up my dude
1,2,RT angstgoddess003 Fuckery is afoot If youve gotten an email from FFn admin within the last month esp from this JAMES mofo could you DM me Tracing IPs
2,2,Perfect time to drive to la Losing my mind in traffic
1,1,jonanntim yeah I talk to them all the time Why
3,1,YUNGDURTY580 yuhhh that Touch Down is my shit and that M town and Loco 
1,2,Huge blast hits Afghan capital
2,2,For those of you who know him were putting Tyson down next week There is a lot wrong with him But he is a good dog and will be in a bett
3,1,eemeer the oral is so easy who are you doing it on mrbean
2,1,I unlocked Win Level 2 in SteamPunk Hockey httpbitlycHX9Kd
1,1,  Are Singles Dating sites Internet Suitable for you personally  There are thousands of online dating sites httpbitlydbmSr5
1,3,benjaminmadden ur lookin ripped dude always been a GC fan looking 4ward to the new material much respect
1,1,RT LondonCP LondonCP new program for 2010 httpbitly9Hv1Hh
1,1,Sigma 1770mm OS Soon Available for Sony and Pentax Cameras
3,1,johncmayer thank you for another incredible night  Im speechless 3
2,1,picked up the book RealityHunger by David Shields today That is correct I disconnect myself from the computer from time to time
1,1,I just took What would Justin Bieber say to you if he turned around and acci and got He say Woah Hi  Try it httpbitlycjsINt
2,1,lightnessalways Intend to do that tomorrow
1,1,RT CTVOlympics Orser finds Olympic redemption with Kim A silver medallist in the Calgary 88 Games Brian Orser admits that coach httpbitlyatWPzM
